{
  "schema_version": 2,
  "scope": "Generic executable acceptance index. Narrative rationale and task state are maintained separately.",
  "families": {
    "DATA": {
      "source_spec_id": "ARCH-TOOL-DATA-001",
      "contract": "docs/contracts/data.md"
    },
    "PROJ": {
      "source_spec_id": "ARCH-TOOL-PROJ-001",
      "contract": "docs/contracts/projections.md"
    },
    "CORE": {
      "source_spec_id": "ARCH-TOOL-CORE-001",
      "contract": "docs/contracts/core.md"
    }
  },
  "requirements": [
    {
      "id": "DATA-01",
      "statement": "Use Pydantic, PyArrow, DataFusion, NetworkX and deltalake with distinct responsibilities and one logical model.",
      "contract_ref": "data.relational-model",
      "implementation_areas": [
        "src/architecture_toolkit/domain",
        "src/architecture_toolkit/storage"
      ],
      "verification": [
        "unit",
        "integration",
        "qualification"
      ]
    },
    {
      "id": "DATA-02",
      "statement": "Retain SQLite as a credible transactional alternative; justify the selected stack by types, revisions and interoperability rather than size.",
      "contract_ref": "data.relational-model",
      "implementation_areas": [
        "src/architecture_toolkit/domain",
        "src/architecture_toolkit/storage"
      ],
      "verification": [
        "unit",
        "integration",
        "qualification"
      ]
    },
    {
      "id": "DATA-03",
      "statement": "Persist a typed relational core, not only JSON node/edge bags.",
      "contract_ref": "data.relational-model",
      "implementation_areas": [
        "src/architecture_toolkit/domain",
        "src/architecture_toolkit/storage"
      ],
      "verification": [
        "unit",
        "integration",
        "qualification"
      ]
    },
    {
      "id": "DATA-04",
      "statement": "Preserve element/model/type identities, independent names and readable aliases.",
      "contract_ref": "data.relational-model",
      "implementation_areas": [
        "src/architecture_toolkit/domain",
        "src/architecture_toolkit/storage"
      ],
      "verification": [
        "unit",
        "integration",
        "qualification"
      ]
    },
    {
      "id": "DATA-05",
      "statement": "Give relationships their own identities and explicit type registry with direction, endpoints, cardinality and traversal rules.",
      "contract_ref": "data.relational-model",
      "implementation_areas": [
        "src/architecture_toolkit/domain",
        "src/architecture_toolkit/storage"
      ],
      "verification": [
        "unit",
        "integration",
        "qualification"
      ]
    },
    {
      "id": "DATA-06",
      "statement": "Store canonical relationship directions and derive inverse views instead of maintaining duplicate inverses.",
      "contract_ref": "data.relational-model",
      "implementation_areas": [
        "src/architecture_toolkit/domain",
        "src/architecture_toolkit/storage"
      ],
      "verification": [
        "unit",
        "integration",
        "qualification"
      ]
    },
    {
      "id": "DATA-07",
      "statement": "Add typed interface, deployment, data-schema, behavior, requirement and notation details only when fields or constraints justify them.",
      "contract_ref": "data.relational-model",
      "implementation_areas": [
        "src/architecture_toolkit/domain",
        "src/architecture_toolkit/storage"
      ],
      "verification": [
        "unit",
        "integration",
        "qualification"
      ]
    },
    {
      "id": "DATA-08",
      "statement": "Represent multi-party handoffs/interactions as first-class objects with typed participants.",
      "contract_ref": "data.relational-model",
      "implementation_areas": [
        "src/architecture_toolkit/domain",
        "src/architecture_toolkit/storage"
      ],
      "verification": [
        "unit",
        "integration",
        "qualification"
      ]
    },
    {
      "id": "DATA-09",
      "statement": "Link evidence and decisions to elements, relationships, fields or releases without building a second evidence platform.",
      "contract_ref": "data.relational-model",
      "implementation_areas": [
        "src/architecture_toolkit/domain",
        "src/architecture_toolkit/storage"
      ],
      "verification": [
        "unit",
        "integration",
        "qualification"
      ]
    },
    {
      "id": "DATA-10",
      "statement": "Nest owned values; normalize independently identified and shared objects.",
      "contract_ref": "data.arrow",
      "implementation_areas": [
        "src/architecture_toolkit/domain",
        "src/architecture_toolkit/storage"
      ],
      "verification": [
        "unit",
        "integration",
        "qualification"
      ]
    },
    {
      "id": "DATA-11",
      "statement": "Keep the explicit interface Arrow schema and its foreign references as an implementation example.",
      "contract_ref": "data.arrow",
      "implementation_areas": [
        "src/architecture_toolkit/domain",
        "src/architecture_toolkit/storage"
      ],
      "verification": [
        "unit",
        "integration",
        "qualification"
      ]
    },
    {
      "id": "DATA-12",
      "statement": "Use the tested Arrow/Delta/DataFusion type intersection, explicit nullability and UTC microsecond instants; avoid baseline unions and extension types.",
      "contract_ref": "data.arrow",
      "implementation_areas": [
        "src/architecture_toolkit/domain",
        "src/architecture_toolkit/storage"
      ],
      "verification": [
        "unit",
        "integration",
        "qualification"
      ]
    },
    {
      "id": "DATA-13",
      "statement": "Use small namespaced extensions only as an escape hatch; promote frequently queried meaning into typed fields.",
      "contract_ref": "data.arrow",
      "implementation_areas": [
        "src/architecture_toolkit/domain",
        "src/architecture_toolkit/storage"
      ],
      "verification": [
        "unit",
        "integration",
        "qualification"
      ]
    },
    {
      "id": "DATA-14",
      "statement": "Use strict Pydantic domain validation and explicit Arrow mappings; validate cross-record architecture independently.",
      "contract_ref": "data.arrow",
      "implementation_areas": [
        "src/architecture_toolkit/domain",
        "src/architecture_toolkit/storage"
      ],
      "verification": [
        "unit",
        "integration",
        "qualification"
      ]
    },
    {
      "id": "DATA-15",
      "statement": "Use DataFusion for relational queries, comparisons and tabular validation; qualify recursive SQL where needed.",
      "contract_ref": "data.query",
      "implementation_areas": [
        "src/architecture_toolkit/queries"
      ],
      "verification": [
        "unit",
        "integration",
        "qualification"
      ]
    },
    {
      "id": "DATA-16",
      "statement": "Construct disposable NetworkX projections from release-selected records; return typed/Arrow results.",
      "contract_ref": "data.query",
      "implementation_areas": [
        "src/architecture_toolkit/queries"
      ],
      "verification": [
        "unit",
        "integration",
        "qualification"
      ]
    },
    {
      "id": "DATA-17",
      "statement": "Implement named traversal policies and retain paths, versions and evidence; do not equate reachability with certain failure.",
      "contract_ref": "data.query",
      "implementation_areas": [
        "src/architecture_toolkit/queries"
      ],
      "verification": [
        "unit",
        "integration",
        "qualification"
      ]
    },
    {
      "id": "DATA-18",
      "statement": "Keep domain mutation separate from queries; use bound scalar SQL parameters or expressions.",
      "contract_ref": "data.query",
      "implementation_areas": [
        "src/architecture_toolkit/queries"
      ],
      "verification": [
        "unit",
        "integration",
        "qualification"
      ]
    },
    {
      "id": "DATA-19",
      "statement": "Distinguish source history, storage history and architectural history.",
      "contract_ref": "data.release",
      "implementation_areas": [
        "src/architecture_toolkit/releases",
        "src/architecture_toolkit/validation"
      ],
      "verification": [
        "unit",
        "integration",
        "qualification"
      ]
    },
    {
      "id": "DATA-20",
      "statement": "Do not equate a Delta table version with an architecture release or claim native multi-table atomicity.",
      "contract_ref": "data.release",
      "implementation_areas": [
        "src/architecture_toolkit/releases",
        "src/architecture_toolkit/validation"
      ],
      "verification": [
        "unit",
        "integration",
        "qualification"
      ]
    },
    {
      "id": "DATA-21",
      "statement": "Publish an immutable manifest pinning every required table version, schema/profile version, source digest and artifact.",
      "contract_ref": "data.release",
      "implementation_areas": [
        "src/architecture_toolkit/releases",
        "src/architecture_toolkit/validation"
      ],
      "verification": [
        "unit",
        "integration",
        "qualification"
      ]
    },
    {
      "id": "DATA-22",
      "statement": "Start with full snapshots of changed tables, reuse unchanged versions and avoid replay-based micro-edit event sourcing.",
      "contract_ref": "data.release",
      "implementation_areas": [
        "src/architecture_toolkit/releases",
        "src/architecture_toolkit/validation"
      ],
      "verification": [
        "unit",
        "integration",
        "qualification"
      ]
    },
    {
      "id": "DATA-23",
      "statement": "Use one writer, a publication lock and an expected-parent check; stage and read back before exposing a release.",
      "contract_ref": "data.release",